{
  "version": 1,
  "book_id": "alkahest-reference-book",
  "canonical_language": "en-US",
  "language_variants": [
    {
      "language": "en-US",
      "root": ".",
      "mode": "canonical"
    },
    {
      "language": "fr-FR",
      "root": ".",
      "mode": "shared-source",
      "profile": "_quarto-locale-fr.yml"
    }
  ],
  "edition_manifests": [
    "editions.json"
  ],
  "companion_registry": "companion.json",
  "reusable_content_registry": "reusable-content.json",
  "migrations": []
}
